Image,Title,Price,Ratings,Review,Monthly Sales,Product Identifier
https://m.media-amazon.com/images/I/51vxhpeulSL._AC_UL320_.jpg,"Paragon PUK3502GS Sports Shoes for Men | Stylish Design, Comfortable Cushioned Insole, Lace up and Sturdy Grip for Better Fitting, Breathable Upper Material | Ideal for Everyday Use",949,4.0 out of 5 stars,95,,puk gs sports shoes
https://m.media-amazon.com/images/I/615569U-hzL._AC_UL320_.jpg,CLAWWED Weight Lifting Strap and Wrist Support - Gym Accessories for Men and Women - Powerlifting and Strength Training Straps (White),289,3.0 out of 5 stars,2,,weight lifting strap wrist
https://m.media-amazon.com/images/I/41DvwgRCxaL._AC_UL320_.jpg,"MOROVIK Pull Reducer Training Bands-4 Tubes Body Pedal Exerciser Yoga Crossfit Exercise, Arm Exercise, Tummy Body Building Training Men and Womeno (Multi)",379,4.8 out of 5 stars,69,500+ bought in past month,pull reducer training bands
https://m.media-amazon.com/images/I/61mQAPUdgmL._AC_UL320_.jpg,"Optimum Nutrition (ON) Micronized Creatine Powder - 100 Gram, 33 Serves, 3g of 100% Creatine Monohydrate per serve, Supports Athletic Performance & Power, Unflavored.",476,4.3 out of 5 stars,"1,939",3K+ bought in past month,nutrition micronized creatine powder
https://m.media-amazon.com/images/I/61KJmV9Wz8L._AC_UL320_.jpg,"Threptin Protein Diskettes| Healthy Snacks for Men and Women - 275g, High Protein Diskette enriched with Casein Protein, Essential Vitamins, Minerals and Antioxidant -Vanilla Flavor|100% Veg",485,4.4 out of 5 stars,"6,862",2K+ bought in past month,protein diskettes healthy snacks
https://m.media-amazon.com/images/I/61lHSsLXLHL._AC_UL320_.jpg,Boldfit Yoga Mats For Women and Men Exercise For Home Workout Gym Anti Slip EVA Material Yoga Mat 4Mm For Kids Gym Mats - Green,349,4.0 out of 5 stars,"18,844",3K+ bought in past month,yoga mats exercise home
